1,The function is used to initialize variables when the page loads
5,This function handles click events by toggling UI elements
7,Function that validates form inputs before submission
11,Creates and returns a new array with doubled values
13,Asynchronous function that fetches API data
17,Recursive function that calculates factorial values
19,Higher-order function that implements memoization
23,Function that debounces rapid-fire events
25,Generator function that yields Fibonacci sequence
29,Curried function for mathematical operations
31,Function using Web Workers for parallel processing
35,Function that implements JWT authentication
37,Closure that maintains private state counter
41,Function that throttres scroll events
43,Pure function that sorts arrays immutably
47,Function that implements deep object cloning
49,Promise wrapper for callback-based functions